{
    "$schema": "cutin.schema.json",
    "particle": 65535,
    "particle_delays": [ 0, 0 ],
    "models": [ 269, 270 ],
    "actor_delays": [ 0, 0 ],
    "animations1": [ 271, 272, 273, null ],
    "animations2": [ 274, 275, 276, null ],
    "dim_capture": 1,
    "key_list": 34,
    "bitmap_flag": 0,
    "bitmaps": []
}
