{
    "$schema": "cutin.schema.json",
    "particle": 70,
    "particle_delays": [ 8, 0 ],
    "models": [ 71, 72 ],
    "actor_delays": [ 0, 0 ],
    "animations1": [ 73, 74, 75, null ],
    "animations2": [ 76, 77, 78, null ],
    "dim_capture": 1,
    "key_list": 7,
    "bitmap_flag": 1,
    "bitmaps": [
        {
            "texture": "trwb_face001",
            "palette": "trwb_face001_pl",
            "resource": 0,
            "char_file": 0,
            "palette_file": 53,
            "palette_offset": 0,
            "width": 16,
            "height": 16,
            "source_stride": 16,
            "source_offset": 0
        }
    ]
}
